{
  "schemaVersion": "ai-harness-prompt-record-shard/v1",
  "kitVersion": "v38",
  "promptRange": "P03-P03",
  "prompts": [
    {
      "id": "P03",
      "sequence": 3,
      "name": "Repository Evidence + First Sprint Executor",
      "moment": "Repository Evidence + First Sprint Executor",
      "promptType": "DISCOVERY + BUILD",
      "promptClass": "REPO / EVIDENCE + ACTION",
      "executionSurface": "regular_ai_prompt",
      "sprintPathRole": "Analyze the repo and execute the first safe sprint",
      "useForProgress": "YES",
      "useThisWhen": "Entering an unfamiliar, stale, or context-heavy repo.",
      "doNotUseWhen": "A different prompt more directly owns the requested moment.",
      "inspectFirst": "Git floor, rules, architecture, manifests, PRs, plans, tests, validators, artifacts.",
      "expectedOutput": "Cited evidence pack, ranked queue, and first bounded repo mutation.",
      "nextStep": "Use P11 or P12.",
      "acceptanceGate": "Path-grounded evidence plus actual repo movement.",
      "mutatesRepository": "YES",
      "authority": "Repo evidence + first safe bounded mutation",
      "proofCeiling": "Path-grounded evidence plus actual repo movement.",
      "color": "Sky",
      "copySafeSheet": "P03_COPY_SAFE",
      "copyRange": "A1:A127",
      "requiredVariables": [
        "xyz_branch",
        "xyz_plan_directory",
        "xyz_repo_or_path"
      ],
      "textSha256": "60dcd669bb297dad0f5ab7c43019297b524ab29cb532d89fce4d54dc42bc6bdf",
      "text": "ANALYZE THE REPOSITORY, BUILD THE EVIDENCE PACK, THEN EXECUTE THE FIRST SAFE SPRINT. DO NOT STOP AT A PLAN.\nRepo: xyz_repo_or_path\nBranch / PR if known: xyz_branch\nContext or plan path if available: xyz_plan_directory\nMISSION\nRecover operational truth from the repository itself, derive a ranked sprint queue from evidence, and immediately execute the highest-value bounded sprint that is safe in the current environment.\nTreat the current repository as the source of truth over remembered chat context.\nCollect all actionable evidence, not every byte or generated dependency.\nDO NOT ANSWER WITH\n- a repo summary only\n- a plan only\n- a prompt pack only\n- generic best practices without file-path evidence\n- a request for permission when a safe bounded sprint is available\n- confidence based only on filenames, timestamps, or stale handoff prose\nCOMPACT PREFLIGHT\nRun what is available and record exact skips:\ngit rev-parse --show-toplevel\ngit status --short\ngit branch --show-current\ngit log --oneline --decorate -12\ngit worktree list\ngit remote -v\ngh pr list --state open --limit 30\ngh pr status\nIf the worktree is dirty or conflicted:\n- preserve existing work\n- identify the owning branch, files, and likely sprint\n- use or create an isolated worktree when this lane does not own the dirt\n- make repo-floor repair the first sprint only when it is the safest useful move\n- otherwise stop with the exact blocker and safest next command\nREPOSITORY EVIDENCE HARVEST\nInspect the repository before selecting work:\n- local operating law: AGENTS.md, CLAUDE.md, .ai/, skills, workflow rules, CONTRIBUTING, README\n- architecture and entry points: source roots, services, launchers, apps, packages, modules\n- manifests and toolchain: build files, dependency files, task runners, lockfiles, environment contracts\n- recent center of gravity: recent commits, changed files, active branches, open PRs, review comments when available\n- plans and state: docs, status files, roadmaps, handoffs, decision logs, release notes\n- validation surface: tests, validators, linters, type checks, builds, CI workflows, fixtures, smoke scripts\n- harness spine: run context, artifact registry, schemas, workflow specs, reports, hooks, codebase maps\n- agent leverage: repo-local prompts, scoped skills, MCP/LSP or read-only navigation helpers\n- artifacts and output policy: generated files, logs, reports, ignored paths, committed evidence, cleanup rules\n- unresolved signals: TODO, FIXME, XXX, NotImplemented, skipped tests, quarantines, stubs, failing checks\n- runtime and deployment seams: launch scripts, installers, browser flows, target mutation boundaries, safety docs\n- stale or conflicting context: placeholder plans, superseded docs, abandoned branches, contradictory instructions\nEVIDENCE RULES\n- cite exact file paths, commands, commit SHAs, PR numbers, and validator names\n- distinguish FACT, INFERENCE, and UNKNOWN\n- use document content and git history to judge freshness; timestamps alone are weak evidence\n- search existing contracts, helpers, names, scripts, and output patterns before inventing\n- do not expose secrets, credentials, personal data, or huge generated logs\n- do not crawl vendored dependencies or build outputs unless they are directly relevant\n- name unavailable tools and the exact command that should be run later\nBUILD THE REPO EVIDENCE PACK\nProduce a compact operational ledger with these sections:\n1. REPO IDENTITY\n- repo path, branch, HEAD, remotes, worktrees, dirty/conflicted state, open PRs\n2. CURRENT CENTER OF GRAVITY\n- what recent commits and changed files show the repo is actively becoming\n3. ACTIVE WORKSTREAMS\n- feature, harness, cleanup, validation, docs/reporting, runtime proof, release/PR hygiene, research/design\n4. HARNESS INVENTORY\n- present, partial, missing, duplicated, or stale: rules, map, workflows, run context, registry, validators, hooks, skills, reports\n5. PRODUCT / FEATURE INVENTORY\n- implemented surfaces, incomplete surfaces, entry points, and integration boundaries\n6. VALIDATION AND PROOF SURFACE\n- commands, CI jobs, fixtures, artifacts, and the highest proof each can support\n7. UNRESOLVED SIGNALS\n- TODOs, failing or skipped checks, placeholders, stale plans, review requests, unmerged useful work\n8. RISKS AND FORBIDDEN SCOPE\n- mutation risks, credentials, live targets, destructive operations, unrelated rewrite zones\n9. IMPORTANT PATHS\n- the small set of files and directories the next action depends on\nDERIVE THE SPRINT QUEUE\nCreate a ranked list of bounded sprint candidates.\nFor each candidate include:\n- title and lane\n- evidence and why now\n- owned scope and forbidden scope\n- dependencies and collision risks\n- files to inspect and files likely to change\n- expected artifacts\n- validation commands\n- risk and proof ceiling\n- whether it is safe in parallel\nFIRST-SPRINT SELECTION RULES\n- floor before furniture: repair unsafe repo state before feature work\n- shared contracts before reports, dashboards, MCP consumers, or duplicated output shapes\n- unblock the highest number of later sprints with the smallest bounded change\n- prefer a real tested slice over broad documentation or speculative refactoring\n- do not select live mutation or runtime proof when the environment or scope forbids it\nEXECUTE THE FIRST SAFE SPRINT\nState repo, branch, PR/sprint, lane, owned scope, forbidden scope, and expected artifacts.\nThen immediately do one of these:\n1. Modify useful tracked repo files within the selected sprint.\n2. Prove the selected sprint is already complete with committed files and passing checks.\n3. Stop with an exact blocker plus the smallest patch, diff, or file content that should be applied.\nDefault to option 1.\nWork rules:\n- reuse repository patterns\n- keep changes bounded\n- avoid unrelated rewrites\n- add or update tests, validators, scripts, manifests, or operational docs that enforce the behavior\n- do not create a tracked census document merely to narrate the scan\n- persist a repo-intake artifact only when repo conventions or downstream workflows need it\n- keep generated evidence in approved ignored paths unless sanitized tracked evidence is explicitly required\nVALIDATE AND DELIVER\nRun targeted tests, relevant validators/static checks, build checks, and broader checks when practical.\nRun git diff --check, git status --short, git diff --stat, and review the final diff.\nCommit and push or open/update a PR when the environment allows.\nDo not claim a higher proof level than the evidence supports.\nFINAL RESPONSE FORMAT\nREPO EVIDENCE\n- identity, center of gravity, active workstreams, harness gaps, important paths\nSPRINT QUEUE\n- ranked candidates and the first-sprint decision\nWORK COMMITTED\n- summary, files changed, artifacts, commit SHA, push/PR state\nVALIDATION\n- commands, results, skipped checks, proof level reached\nGAPS / RISKS\n- blockers, unknowns, forbidden scope, collision risks\nFINAL GIT STATE\n- git status --short\nNEXT COMMAND\n- one exact command\nDo not include a next-agent prompt. Use P12 only after the repository-derived sprint is complete."
    }
  ]
}
